<!DOCTYPE casa
[
<!ELEMENT casa (familia)>
<!ELEMENT familia (invitacion,nummesa,bebida)>
<!ELEMENT invitacion (invitados)>
<!ELEMENT invitados (#PCDATA)>
<!ELEMENT nummesa (#PCDATA)>
<!ELEMENT bebida (#PCDATA)> 


<!ATTLIST familia apellido CDATA #REQUIRED>
<!ATTLIST invitacion enviada (si|no) #REQUIRED>
<!ATTLIST invitacion numinvitacion ID #REQUIRED>
<!ATTLIST nummesa idnummesa IDREF #REQUIRED>
<!ATTLIST invitados autorizados NMTOKENS #REQUIRED>

<!ENTITY ron "RON">
<!ENTITY cognac "COGNAC">
]>

<casa>
  <familia apellido="Diaz Medina">
    <invitacion enviada="si" numinvitacion="1234">
      <invitados autorizados="valery_garibay brian_soria">
      </invitados>
    </invitacion>
    <nummesa idnummesa="1234">
    </nummesa>
    <bebida>&ron;&cognac;</bebida>
  </familia>
</casa>